Type,Продукт,Калорийность,Белки,Жиры,Углеводы
Кондитерские_изделия,"Агар (*в т. ч. НПВ-75,6)",12 кКал,2 г,0 г,"0,8 г"
Кондитерские_изделия,Агар пищевой,16 кКал,4 г,0 г,0 г
Кондитерские_изделия,Батончики на кондитерском жире,527 кКал,"3,3 г","30,5 г","62,5 г"
Кондитерские_изделия,Вафли с жировыми начинками,542 кКал,"3,9 г","30,6 г","62,5 г"
Кондитерские_изделия,Вафли с фруктово-ягодными начинками,354 кКал,"2,8 г","3,3 г","77,3 г"
Кондитерские_изделия,Галеты,393 кКал,"9,7 г","10,2 г","65,6 г"
Кондитерские_изделия,"Галеты, из муки высшего сорта",415 кКал,"9,7 г","10,2 г","68,4 г"
Кондитерские_изделия,"Галеты, из муки первого сорта",345 кКал,11 г,"1,4 г","69,5 г"
Кондитерские_изделия,Глазурь жировая,547 кКал,"3,9 г","37,2 г","48,9 г"
Кондитерские_изделия,Глазурь шоколадная,542 кКал,"4,9 г","34,5 г","52,5 г"
Кондитерские_изделия,"Десерт, хрустящие яблоки, приготовленные по рецепту",161 кКал,"1,75 г","3,43 г","29,44 г"
Кондитерские_изделия,"Десерт, шоколадный мусс, приготовленный по рецепту",225 кКал,"4,14 г",16 г,"15,47 г"
Кондитерские_изделия,Драже сахарное,393 кКал,0 г,0 г,"97,7 г"
Кондитерские_изделия,"Драже, ореховое","547,5 кКал","11,9 г","38,3 г","41,4 г"
Кондитерские_изделия,"Драже, фруктово-ягодное в шоколаде",389 кКал,"3,7 г","10,2 г","73,1 г"
Кондитерские_изделия,"Жвачка, 360 ккал",360 кКал,0 г,"0,3 г","94,3 г"
Кондитерские_изделия,"Жвачка, без сахара, 268 ккал",268 кКал,0 г,"0,4 г","92,4 г"
Кондитерские_изделия,Желатин пищевой,355 кКал,"87,2 г","0,4 г","0,7 г"
Кондитерские_изделия,"Желатин, сухой порошок, неподслащенный",335 кКал,"85,6 г","0,1 г",0 г
Кондитерские_изделия,"Желе, десерт, сухая смесь, малокалорийный, с добавками: аспаратам (E951)",198 кКал,"15,67 г",0 г,"80,11 г"
Кондитерские_изделия,"Желе, десерт, сухая смесь, малокалорийный, с добавками: аспаратам (E951), без доб. натрия",345 кКал,"55,3 г",0 г,"33,3 г"
Кондитерские_изделия,"Желе, десерт, сухая смесь, малокалорийный, с добавками: аспаратам (E951), приготовленный на воде",20 кКал,"0,83 г",0 г,"4,22 г"
Кондитерские_изделия,"Желе, десерт, сухая смесь, малокалорийный, с добавками: аспаратам (E951), фосфор, калий, натрий, витамин C",345 кКал,"55,3 г",0 г,"33,3 г"
Кондитерские_изделия,"Желе, десерт, сухая смесь, приготовленный на воде",60 кКал,"1,22 г",0 г,"14,19 г"
Кондитерские_изделия,"Желе, десерт, сухая смесь, с доб. аскорбиновой кислоты, цитрата натрия, и соли",381 кКал,"7,8 г",0 г,"90,5 г"
Кондитерские_изделия,"Желе, сухая смесь",381 кКал,"7,8 г",0 г,"90,5 г"
Кондитерские_изделия,Жир кондитерский для шоколадных изделий,897 кКал,0 г,"99,7 г",0 г
Кондитерские_изделия,Жир кондитерский твердый,898 кКал,0 г,"99,8 г",0 г
Кондитерские_изделия,Заварные трубочки с кремом,329 кКал,"5,9 г","10,2 г","55,2 г"
Кондитерские_изделия,"Замороженный йогурт, шоколадный",131 кКал,3 г,"3,6 г","19,3 г"
Кондитерские_изделия,Зефир,326 кКал,"0,8 г","0,1 г","79,8 г"
Кондитерские_изделия,"Зефир, глазированный шоколадом",396 кКал,"2,2 г","12,3 г","68,4 г"
Кондитерские_изделия,Ирис полутвердый,408 кКал,"3,3 г","7,6 г","81,5 г"
Кондитерские_изделия,Ирис тираженный,443 кКал,"6,6 г","15,9 г","68,2 г"
Кондитерские_изделия,Какао-порошок,289 кКал,"24,3 г",15 г,"10,2 г"
Кондитерские_изделия,"Какао-порошок, неподслащенный",228 кКал,"19,6 г","13,7 г","20,9 г"
Кондитерские_изделия,"Какао-порошок, неподслащенный, HERSHEY'S European Style Cocoa",410 кКал,20 г,10 г,40 г
Кондитерские_изделия,"Какао-порошок, неподслащенный, прошедший алкализацию",220 кКал,"18,1 г","13,1 г","28,5 г"
Кондитерские_изделия,"Какао-порошок, с высоким содерж. жира, или для завтрака, прошедший алкализацию",479 кКал,"16,8 г","23,71 г","15,81 г"
Кондитерские_изделия,Какаовелла,147 кКал,15 г,"4,5 г",11 г
Кондитерские_изделия,Карамель глазированная,378 кКал,1 г,"0,8 г","92,9 г"
Кондитерские_изделия,"Карамель, леденцовая",384 кКал,0 г,0 г,"95,8 г"
Кондитерские_изделия,"Карамель, с ликерными начинками",358 кКал,0 г,"0,1 г","92,6 г"
Кондитерские_изделия,"Карамель, с молочными начинками",377 кКал,"0,8 г",1 г,"91,2 г"
Кондитерские_изделия,"Карамель, с ореховыми начинками",410 кКал,"3,1 г","7,3 г","86,6 г"
Кондитерские_изделия,"Карамель, с помадными начинками",366 кКал,0 г,"0,1 г","94,7 г"
Кондитерские_изделия,"Карамель, с прохладительными начинками",429 кКал,0 г,10 г,88 г
Кондитерские_изделия,"Карамель, с фруктово-ягодными начинками",371 кКал,"0,1 г","0,1 г","92,4 г"
Кондитерские_изделия,"Карамель, с шоколадно-ореховыми начинками",427 кКал,"1,6 г",8 г,"87,1 г"
Кондитерские_изделия,Конфеты глазированные шоколадом с желейными корпусами,359 кКал,"1,4 г","8,2 г","69,4 г"
Кондитерские_изделия,"Конфеты глазированные шоколадом, ассорти с пралиновыми начинками",533 кКал,"6,9 г","30,8 г","56,9 г"
Кондитерские_изделия,"Конфеты глазированные шоколадом, с грильяжными корпусами",489 кКал,"7,8 г",22 г,"64,9 г"
Кондитерские_изделия,"Конфеты глазированные шоколадом, с комбинированными корпусами",414 кКал,"3,9 г","14,6 г","69,7 г"
Кондитерские_изделия,"Конфеты глазированные шоколадом, с кремово-сбивными корпусами",463 кКал,"2,7 г","25,8 г","54,7 г"
Кондитерские_изделия,"Конфеты глазированные шоколадом, с кремовыми корпусами",523 кКал,"7,5 г","31,8 г","53,6 г"
Кондитерские_изделия,"Конфеты глазированные шоколадом, с начинками между слоями вафель",535 кКал,"5,8 г",32 г,"57,9 г"
Кондитерские_изделия,"Конфеты глазированные шоколадом, с помадными корпусами",399 кКал,"1,5 г","7,2 г","81,8 г"
Кондитерские_изделия,"Конфеты глазированные шоколадом, с пралине со слоями вафель",533 кКал,"6,6 г",31 г,"56,6 г"
Кондитерские_изделия,"Конфеты глазированные шоколадом, с пралиновыми корпусами",533 кКал,"6,9 г","30,8 г","56,9 г"
Кондитерские_изделия,"Конфеты глазированные шоколадом, с фруктовыми корпусами",369 кКал,"1,6 г","8,6 г","74,3 г"
Кондитерские_изделия,"Конфеты глазированные шоколадом, с шоколадно-кремовыми корпусами",569 кКал,4 г,"39,5 г","51,3 г"
Кондитерские_изделия,"Конфеты глазированные шоколадом, с шоколадно-ореховыми корпусами",547 кКал,"6,4 г","34,6 г","54,6 г"
Кондитерские_изделия,"Конфеты глазированные шоколадом, со сбивными корпусами",413 кКал,3 г,"15,5 г",65 г
Кондитерские_изделия,Конфеты неглазированные шоколадные,491 кКал,4 г,"26,3 г","59,2 г"
Кондитерские_изделия,"Конфеты неглазированные, молочные",364 кКал,"2,7 г","4,3 г","82,3 г"
Кондитерские_изделия,"Конфеты неглазированные, помадные",445 кКал,"3,7 г","16,2 г","70,9 г"
Кондитерские_изделия,"Конфеты неглазированные, фруктово-помадные",346 кКал,0 г,0 г,"90,6 г"
Кондитерские_изделия,"Конфеты,  ALMOND JOY BITES",563 кКал,"5,58 г","34,5 г","53,24 г"
Кондитерские_изделия,"Конфеты, MASTERFOODS USA, MILKY WAY Карамель, в глазури из молочного шоколада",463 кКал,"4,28 г","19,17 г","67,79 г"
Кондитерские_изделия,"Конфеты, батончик  5TH AVENUE (произв: Корпорация Hershey)",482 кКал,"8,78 г","23,98 г","59,58 г"
Кондитерские_изделия,"Конфеты, батончик ALMOND JOY (произв: Hershey)",479 кКал,"4,13 г","26,93 г","54,51 г"
Кондитерские_изделия,"Конфеты, батончик BUTTERFINGER (произв: Нестле), NESTLE",459 кКал,"5,4 г","18,9 г","70,9 г"
Кондитерские_изделия,"Конфеты, батончик Сникерс, SNICKERS (произв: MASTERFOODS USA)",491 кКал,"7,53 г","23,85 г","59,21 г"
Кондитерские_изделия,"Конфеты, баточник 3 MUSKETEERS (произв: Мастерфудз США)",436 кКал,"2,6 г","12,75 г","76,27 г"
Кондитерские_изделия,"Конфеты, в шоколадной глазури, диетические или низкокалорийные",590 кКал,"12,39 г","43,27 г","34,18 г"
Кондитерские_изделия,"Конфеты, ирис",391 кКал,"0,03 г","3,3 г","90,4 г"
Кондитерские_изделия,"Конфеты, карамель",382 кКал,"4,6 г","8,1 г",77 г
Кондитерские_изделия,"Конфеты, карамель с орехами в шоколадной глазури",470 кКал,"9,5 г",21 г,"56,37 г"
Кондитерские_изделия,"Конфеты, Твикс, печенье с карамелью и шоколадом (произв: MASTERFOODS USA)",502 кКал,"4,91 г","24,85 г","63,7 г"
Кондитерские_изделия,Крекеры с цельнозерновой пшеничной мукой,463 кКал,"7,29 г","17,84 г","63,47 г"
Кондитерские_изделия,"Крекеры, из муки высшего сорта",439 кКал,"9,2 г","14,1 г","66,1 г"
Кондитерские_изделия,Ксилит пищевой,367 кКал,0 г,0 г,"97,9 г"
Кондитерские_изделия,"Кукурузный сироп, светлый",283 кКал,0 г,"0,2 г","76,79 г"
Кондитерские_изделия,"Кукурузный сироп, темный",286 кКал,0 г,0 г,"77,59 г"
Кондитерские_изделия,Лукум сбивной,316 кКал,"0,8 г","0,7 г","79,4 г"
Кондитерские_изделия,Мармелад,321 кКал,"0,1 г",0 г,"79,4 г"
Кондитерские_изделия,Мармелад желейный,321 кКал,"0,1 г",0 г,"79,4 г"
Кондитерские_изделия,"Мармелад, фруктово-ягодный глазированный шоколадом",349 кКал,"1,5 г","9,2 г","64,2 г"
Кондитерские_изделия,Мед пчелиный,328 кКал,"0,8 г",0 г,"80,3 г"
Кондитерские_изделия,"Меласса, черная патока",290 кКал,0 г,"0,1 г","74,73 г"
Кондитерские_изделия,"Мороженне, ванильное",207 кКал,"3,5 г",11 г,"22,9 г"
Кондитерские_изделия,"Мороженое, ванильное, жирное, 16.2% жира",249 кКал,"3,5 г","16,2 г","22,29 г"
Кондитерские_изделия,"Мороженое, ванильное, лайт, без доб. сахара, 7.45% жира",169 кКал,"3,97 г","7,45 г","21,42 г"
Кондитерские_изделия,"Мороженое, ванильное, лайт, магкое морожено, 2.6 жир",126 кКал,"4,9 г","2,6 г","21,8 г"
Кондитерские_изделия,"Мороженое, ванильное, легкое",180 кКал,"4,78 г","4,83 г","29,16 г"
Кондитерские_изделия,"Мороженое, ванильное, обезжиренное, 0% жира",138 кКал,"4,48 г",0 г,"29,06 г"
Кондитерские_изделия,"Мороженое, клубничное, 8.4% жира",192 кКал,"3,2 г","8,4 г","26,7 г"
Кондитерские_изделия,"Мороженое, обычное, низкоуглеводное, ванильное, 12.7% жира",216 кКал,"3,17 г","12,7 г","17,43 г"
Кондитерские_изделия,"Мороженое, обычное, низкоуглеводное, шоколадное, 12.7% жира",237 кКал,"3,8 г","12,7 г",22 г
Кондитерские_изделия,"Мороженое, французское, ванильное, мягкое, 13% жира",222 кКал,"4,1 г",13 г,"21,5 г"
Кондитерские_изделия,"Мороженое, шоколадное, 11% жира",216 кКал,"3,8 г",11 г,27 г
Кондитерские_изделия,"Мороженое, шоколадное, жирное, 17% жира",251 кКал,"4,72 г","16,98 г","18,88 г"
Кондитерские_изделия,"Мороженое, шоколадное, лайт, 7.19 жир",187 кКал,5 г,"7,19 г","24,9 г"
Кондитерские_изделия,"Мороженое, шоколадное, лайт, без доб. сахара, 5.74% жира",173 кКал,"3,54 г","5,74 г","25,89 г"
Кондитерские_изделия,Пастила,324 кКал,"0,5 г",0 г,80 г
Кондитерские_изделия,"Пастила, глазированная шоколадом",402 кКал,"1,9 г",12 г,"70,9 г"
Кондитерские_изделия,Патока кукурузная,316 кКал,0 г,"0,3 г","78,3 г"
Кондитерские_изделия,"Пектин (*в т. ч. РПВ-69,9)",52 кКал,"3,5 г",0 г,"9,3 г"
Кондитерские_изделия,"Пектин, жидкий",11 кКал,0 г,0 г,0 г
Кондитерские_изделия,"Печенье овсяное, промышленного изготовления, обычное",450 кКал,"6,2 г","18,1 г","65,9 г"
Кондитерские_изделия,Печенье сахарное из муки первого сорта,407 кКал,"7,4 г","9,4 г","73,1 г"
Кондитерские_изделия,Печенье сдобное,451 кКал,"6,4 г","16,8 г","68,5 г"
Кондитерские_изделия,"Печенье сливочное, промышленного изготовления, необогащенное",467 кКал,"6,1 г","18,8 г","68,1 г"
Кондитерские_изделия,"Печенье сливочное, промышленного изготовления, обогащенное",467 кКал,"6,1 г","18,8 г","68,1 г"
Кондитерские_изделия,"Печенье, ванильные вафли, с повышенным содерж. жира, 19,4%",455 кКал,"4,9 г","16,41 г",71 г
Кондитерские_изделия,"Печенье, ванильные вафли, с пониженным содерж. жира, 15.2%",441 кКал,5 г,"15,2 г","71,7 г"
Кондитерские_изделия,"Печенье, ванильный сэндвич с кремовой начинкой",483 кКал,"4,5 г",20 г,"70,6 г"
Кондитерские_изделия,"Печенье, затяжное из муки высшего сорта",414 кКал,"8,5 г","11,3 г","69,7 г"
Кондитерские_изделия,"Печенье, затяжное из муки первого сорта",396 кКал,"7,7 г","9,1 г","70,9 г"
Кондитерские_изделия,"Печенье, овсяное, охлажденное тесто",424 кКал,"5,4 г","18,9 г","56,6 г"
Кондитерские_изделия,"Печенье, овсяное, охлажденное тесто, испеченное",471 кКал,6 г,21 г,"62,9 г"
Кондитерские_изделия,"Печенье, овсяное, с изюмом",441 кКал,"5,86 г","15,76 г","65,65 г"
Кондитерские_изделия,"Печенье, овсяное, сухая смесь",462 кКал,"6,5 г","19,2 г","67,3 г"
Кондитерские_изделия,"Печенье, с пониженным содержанием сахара",493 кКал,"8,3 г","23,6 г","61,2 г"
Кондитерские_изделия,"Печенье, сахарное из муки высшего сорта",417 кКал,"7,5 г","9,8 г","74,4 г"
Кондитерские_изделия,"Печенье, сахарное, охлажденное тесто, испеченное",489 кКал,"4,7 г","23,1 г","64,7 г"
Кондитерские_изделия,"Печенье, сахарные вафли с кремовой начинкой, обычные",502 кКал,"3,84 г","23,24 г","69,04 г"
Кондитерские_изделия,"Печенье, сдобное миндальное",422 кКал,"7,6 г","13,6 г","67,4 г"
Кондитерские_изделия,"Печенье, шоколадное, приготовленное по рецепту",466 кКал,"6,2 г","29,1 г","50,2 г"
Кондитерские_изделия,"Печенье, шоколадное, промышленного изготовления",405 кКал,"4,8 г","16,3 г","61,8 г"
Кондитерские_изделия,"Печенье, шоколадное, сухая смесь, диетическая",426 кКал,"2,9 г","12,5 г","76,2 г"
Кондитерские_изделия,"Печенье, шоколадное, сухая смесь, стандартная",434 кКал,4 г,"14,9 г","76,6 г"
Кондитерские_изделия,"Печенье, шоколадные кусочки, промышленного изготовления, мягкое",444 кКал,"3,63 г","19,77 г","63,95 г"
Кондитерские_изделия,"Печенье, шоколадные кусочки, промышленного изготовления, станд., с повышенным содержанием жира, необогащенное",481 кКал,"5,4 г","22,6 г","64,3 г"
Кондитерские_изделия,"Печенье, шоколадные кусочки, промышленного изготовления, станд., с повышенным содержанием жира, обогащенное",492 кКал,"5,1 г","24,72 г","63,36 г"
Кондитерские_изделия,"Печенье, шоколадные кусочки, промышленного изготовления, станд., с пониженным содержанием жира",451 кКал,"5,97 г","17,91 г","64,49 г"
Кондитерские_изделия,Пирожное бисквитное с белковым кремом,336 кКал,"4,4 г","7,3 г","63,1 г"
Кондитерские_изделия,Пирожное вафельное молочное,572 кКал,"4,8 г","36,7 г","55,3 г"
Кондитерские_изделия,Пирожное воздушное с кремом,440 кКал,"2,6 г","20,8 г","60,5 г"
Кондитерские_изделия,Пирожное заварное с кремом (трубочка),433 кКал,"4,4 г","24,5 г","48,8 г"
Кондитерские_изделия,Пирожное крошковое,388 кКал,"5,9 г","19,4 г","47,5 г"
Кондитерские_изделия,Пирожное миндальное,433 кКал,"8,5 г","16,2 г","63,2 г"
Кондитерские_изделия,Пирожное песочное с кремом,485 кКал,"5,1 г","28,2 г","52,1 г"
Кондитерские_изделия,Пирожное песочное с фруктовой начинкой,435 кКал,"5,1 г","18,5 г","62,6 г"
Кондитерские_изделия,Пирожное слоеное с белковым кремом,461 кКал,"6,1 г",26 г,"50,6 г"
Кондитерские_изделия,"Пирожное, белково-сбивное",468 кКал,"2,8 г","24,3 г","62,6 г"
Кондитерские_изделия,"Пирожное, бисквитное, с фруктовой начинкой",351 кКал,"4,7 г","9,3 г","64,2 г"
Кондитерские_изделия,"Пирожное, слоеное с кремом",555 кКал,"5,4 г","38,6 г","46,4 г"
Кондитерские_изделия,"Пирожное, слоеное с яблочной начинкой",466 кКал,"5,7 г","25,6 г","52,7 г"
Кондитерские_изделия,Плитки кондитерские,537 кКал,"7,8 г","34,6 г","48,1 г"
Кондитерские_изделия,Плитки кондитерские сладкие,552 кКал,"6,2 г","34,2 г","54,5 г"
Кондитерские_изделия,Пралине с ржаной мукой,567 кКал,"4,7 г","37,7 г",52 г
Кондитерские_изделия,"Пралине с соевой мукой (*раффинозы и стахиозы менее 0,3%)",535 кКал,"9,9 г","32,2 г","51,2 г"
Кондитерские_изделия,Пряники заварные,366 кКал,"5,9 г","4,7 г",75 г
Кондитерские_изделия,Пряники сырцовые,346 кКал,"6,3 г","2,1 г","75,6 г"
Кондитерские_изделия,"Пудинг из тапиоки, приготовленный на цельном молоке",115 кКал,"2,84 г","2,89 г","19,43 г"
Кондитерские_изделия,"Пудинг, банановый, быстрого приготовления, приготовленный на цельном молоке",115 кКал,"2,62 г","2,8 г","19,76 г"
Кондитерские_изделия,"Пудинг, банановый, обычный, приготовленный на цельном молоке",111 кКал,"2,74 г","2,89 г","18,44 г"
Кондитерские_изделия,"Пудинг, банановый, сухая смесь, быстрого приготовления",367 кКал,0 г,"0,6 г","92,7 г"
Кондитерские_изделия,"Пудинг, банановый, сухая смесь, быстрого приготовления, с доб масла",386 кКал,0 г,"4,4 г",89 г
Кондитерские_изделия,"Пудинг, банановый, сухая смесь, обычный",366 кКал,0 г,"0,4 г","92,7 г"
Кондитерские_изделия,"Пудинг, банановый, сухая смесь, обычный, с доб масла",387 кКал,0 г,5 г,"88,1 г"
Кондитерские_изделия,"Пудинг, ванильный, быстрого приготовления, приготовленный на цельном молоке",114 кКал,"2,7 г","2,9 г","19,7 г"
Кондитерские_изделия,"Пудинг, ванильный, готовый к употреблению",130 кКал,"1,45 г","3,78 г","22,6 г"
Кондитерские_изделия,"Пудинг, ванильный, готовый к употреблению, обезжиренный",89 кКал,"2,02 г",0 г,"20,16 г"
